use_case,name,when_to_use,detail_files,artifact_templates,script,risk_level
review-working-tree,Review Working Tree,"Another agent changed files and the user wants cursor-agent to review uncommitted work","references/cli-contract.md;references/review-changes-playbook.md;references/output-rubric.md","templates/review-prompt.md;templates/review-report.md",scripts/cursor-review-changes.sh,medium
review-branch,Review Branch Diff,"The user wants cursor-agent to review committed branch changes against a base ref","references/cli-contract.md;references/review-changes-playbook.md;references/output-rubric.md","templates/review-prompt.md;templates/review-report.md",scripts/cursor-review-changes.sh,medium
second-opinion,Second Opinion,"The user wants cursor-agent to analyze a decision, bug, plan, or architecture, optionally under a different model such as gpt-5 or sonnet-4","references/cli-contract.md;references/delegation-playbook.md;references/output-rubric.md","templates/delegation-prompt.md",scripts/cursor-ask.sh,medium
prompt-prep,Prepare Prompt Only,"The user wants a safe cursor-agent prompt or command without invoking the CLI yet","references/cli-contract.md;references/delegation-playbook.md","templates/review-prompt.md;templates/delegation-prompt.md",scripts/cursor-review-changes.sh,low
diagnose,Diagnose Cursor Setup,"cursor-agent auth, workspace trust, model availability, or runtime health is unclear","references/cli-contract.md","",scripts/cursor-doctor-check.sh,low
